[
  {
    "id": "synergy.student.enrollment.table",
    "sourceSystem": "synergy",
    "entityType": "table",
    "elementName": "Student Enrollment",
    "entityPath": "synergy.student.enrollment",
    "description": "Stores student enrollment records including enrollment dates, status, and enrollment type across academic terms.",
    "businessMeaning": "Core enrollment information for each student used by attendance, scheduling, and district/state reporting. Supports incremental changes when students enroll, withdraw, or change status.",
    "domain": "Student Information",
    "tags": ["enrollment", "student", "registration", "core"],
    "content": "Synergy Student Enrollment table. Stores student enrollment records including dates, status, and type. Business usage includes attendance roll-ups, scheduling eligibility, and compliance reporting. Domain: Student Information. Source: STU_ENROLLMENT.",
    "lastUpdated": "2026-02-02T12:00:00Z",
    "schemaVersion": "1.0.0",
    "sourceTable": "STU_ENROLLMENT"
  },
  {
    "id": "synergy.student.demographics.ethnicity.column",
    "sourceSystem": "synergy",
    "entityType": "column",
    "elementName": "Ethnicity",
    "entityPath": "synergy.student.demographics.ethnicity",
    "description": "Primary reported ethnicity of the student as captured in Synergy.",
    "businessMeaning": "Used for equity reporting, subgroup analysis, and compliance. Values align to district-adopted codes and may map to CEDS definitions.",
    "domain": "Student Information",
    "tags": ["demographics", "equity", "reporting"],
    "content": "Student demographics column Ethnicity. Captures the student's primary reported ethnicity for compliance and equity analysis. Domain: Student Information. Data type: VARCHAR(50). Source table: STU_DEMOGRAPHICS. CEDS reference: https://ceds.ed.gov/element/001234.",
    "lastUpdated": "2026-02-02T12:05:00Z",
    "schemaVersion": "1.0.0",
    "dataType": "VARCHAR(50)",
    "sourceTable": "STU_DEMOGRAPHICS",
    "cedsReference": "https://ceds.ed.gov/element/001234",
    "lineage": ["synergy.student.demographics.table"]
  },
  {
    "id": "synergy.attendance.daily.dataset",
    "sourceSystem": "synergy",
    "entityType": "dataset",
    "elementName": "Daily Attendance",
    "entityPath": "synergy.attendance.daily",
    "description": "Aggregated daily attendance facts derived from classroom period-level submissions.",
    "businessMeaning": "Supports dashboards and interventions with daily present/absent counts per student and campus. Used by principals and counselors to monitor attendance trends.",
    "domain": "Attendance",
    "tags": ["attendance", "daily", "aggregation"],
    "content": "Daily Attendance dataset aggregated from period-level attendance entries. Provides per-student, per-campus present/absent indicators for dashboards and interventions. Domain: Attendance. Lineage: synergy.attendance.period.element.",
    "lastUpdated": "2026-02-02T12:10:00Z",
    "schemaVersion": "1.0.0",
    "lineage": ["synergy.attendance.period.element"]
  },
  {
    "id": "synergy.student.primaryLanguage.element",
    "sourceSystem": "synergy",
    "entityType": "element",
    "elementName": "Primary Language",
    "entityPath": "synergy.student.primaryLanguage",
    "businessMeaning": "Indicates the primary language spoken by the student at home. Used for EL identification and services planning.",
    "domain": "Student Information",
    "tags": ["language", "EL", "services"],
    "content": "Student Primary Language element used for English Learner services planning and compliance. Domain: Student Information. May map to CEDS language elements.",
    "lastUpdated": "2026-02-02T12:12:00Z",
    "schemaVersion": "1.0.0",
    "cedsReference": "CEDS-00001"
  },
  {
    "id": "synergy.scheduling.course.section.table",
    "sourceSystem": "synergy",
    "entityType": "table",
    "elementName": "Course Section",
    "entityPath": "synergy.scheduling.course.section",
    "description": "Defines course sections including term, period, room, teacher, and capacity.",
    "businessMeaning": "Backbone of scheduling operations. Used to place students, allocate staff time, and manage classroom resources.",
    "domain": "Scheduling",
    "tags": ["scheduling", "courses", "sections"],
    "content": "Course Section table with term, period, room, teacher assignments, and capacity settings. Supports student placement and staff allocation. Domain: Scheduling.",
    "lastUpdated": "2026-02-02T12:15:00Z",
    "schemaVersion": "1.0.0",
    "sourceTable": "SCHED_SECTION"
  },
  {
    "id": "synergy.student.enrollment.status.column",
    "sourceSystem": "synergy",
    "entityType": "column",
    "elementName": "Status",
    "entityPath": "synergy.student.enrollment.status",
    "description": "Current enrollment status code for the student (e.g., Active, Withdrawn, Graduated).",
    "businessMeaning": "Ambiguous label 'Status' clarified: represents enrollment status driving eligibility for services and funding.",
    "domain": "Student Information",
    "tags": ["status", "eligibility", "funding"],
    "content": "Enrollment Status column indicating Active/Withdrawn/Graduated codes that control service eligibility and funding logic. Domain: Student Information. Data type: VARCHAR(20). Source: STU_ENROLLMENT.",
    "lastUpdated": "2026-02-02T12:18:00Z",
    "schemaVersion": "1.0.0",
    "dataType": "VARCHAR(20)",
    "sourceTable": "STU_ENROLLMENT",
    "lineage": ["synergy.student.enrollment.table"]
  },
  {
    "id": "synergy.student.accommodations.504Indicator.element",
    "sourceSystem": "synergy",
    "entityType": "element",
    "elementName": "504 Indicator",
    "entityPath": "synergy.student.accommodations.504Indicator",
    "description": "Flag indicating whether a student has a Section 504 accommodation plan.",
    "businessMeaning": "Supports compliance and service planning; used by counselors and special programs to ensure appropriate supports.",
    "domain": "Student Services",
    "tags": ["504", "accommodations", "compliance"],
    "content": "504 Indicator element signaling the presence of a Section 504 plan. Used for compliance tracking and service planning. Domain: Student Services.",
    "lastUpdated": "2026-02-02T12:20:00Z",
    "schemaVersion": "1.0.0",
    "dataType": "BOOLEAN",
    "cedsReference": "CEDS-01234"
  },
  {
    "id": "synergy.assessment.results.dataset",
    "sourceSystem": "synergy",
    "entityType": "dataset",
    "elementName": "Assessment Results",
    "entityPath": "synergy.assessment.results",
    "description": "Student-level assessment scores and performance levels across standardized tests.",
    "businessMeaning": "Used by campus leadership and teachers to analyze performance, identify gaps, and inform instruction.",
    "domain": "Assessment",
    "tags": ["assessment", "scores", "performance"],
    "content": "Assessment Results dataset with student scores and performance levels from standardized assessments. Enables gap analysis and instructional planning. Domain: Assessment.",
    "lastUpdated": "2026-02-02T12:25:00Z",
    "schemaVersion": "1.0.0",
    "lineage": ["synergy.assessment.source.element"]
  }
]